{
  "accepted_counterpole_points": [
    "The 783 image figure is superseded; the frozen effa805 inventory reports 799 unique public assets across six surfaces.",
    "The extmetadata premise is withdrawn: both tools request iiprop=url|mime only; no license metadata is received and discarded.",
    "Matisse/Kahlo exposure is asserted only from the register, never from cross-store presence, with zero suppressed-branch leakage.",
    "Legal status is determined only by qualified review; the owner may accept documented residual risk but not determine the law.",
    "Warning-only interruption recovery is replaced by exact-checkpoint persistence at all five frozen checkpoints.",
    "Per-type search quotas are withdrawn in favor of frozen fixture outcomes.",
    "The historical fourteen-unit plan is superseded by a fresh 22-unit feasibility assessment.",
    "Release positioning carries proportional factual and rights obligations rather than being a binary editorial-vs-reference choice.",
    "Deck-warning repair is not pre-authorized; corrections require editorial merit or a dated owner exception."
  ],
  "adaptations": [
    {
      "change": "Onboarding interruption recovery uses a new additive sessionStorage key persisting materialized deck state (ids, answers, progress), not the Math.random seed.",
      "constraint": "AC7 requires resume at the exact checkpoint with prior answers intact; warning-only handling is rejected.",
      "disposition": "accept",
      "evidence": [
        "protocol/tasks/PIG-001/evidence/feasibility-assessment-r2.md R2(a)",
        "js/app.js:2547-2552"
      ],
      "intent_preserved": true,
      "reason": "The deck is Math.random-seeded at js/app.js:2548-2550, so it is not reproducible from a seed; only materialized state can restore the exact checkpoint.",
      "user_consequence": "Onboarding progress survives reload/back-forward within the tab; the durable Passport schema is untouched."
    },
    {
      "change": "Search fix raises the effective cap ahead of type-fair slicing and tiers exact over prefix over substring instead of reserving per-type quotas.",
      "constraint": "AC21 requires that exact and meaningful matches are not starved by incidental substrings, ordering, or caps, verified against the frozen fixture.",
      "disposition": "accept",
      "evidence": [
        "protocol/tasks/PIG-001/evidence/feasibility-assessment-r2.md R2(h)",
        "protocol/tasks/PIG-001/unrouted/ux-requirements.md F1-F24"
      ],
      "intent_preserved": true,
      "reason": "The revision withdrew the per-type-quota prescription as an implementation choice, not a theory requirement.",
      "user_consequence": "Exact and meaningful matches surface reliably; acceptance is gated on the frozen fixture rather than a prescribed mechanism."
    },
    {
      "change": "The historical fourteen-unit plan is superseded by a 22-unit plan from a fresh Implementation Lead assessment.",
      "constraint": "AC27 requires a fresh assessment identifying dependencies and reversibility limits.",
      "disposition": "accept",
      "evidence": [
        "protocol/tasks/PIG-001/evidence/feasibility-assessment-r2.md R2, R3, R4"
      ],
      "intent_preserved": true,
      "reason": "The revision required fresh feasibility against the complete effa805 scope and forbade reusing the fourteen-unit plan as complete evidence.",
      "user_consequence": "None directly; a broader, evidence-backed plan reduces the risk of an under-specified build."
    }
  ],
  "analysis_mode": "convergence_review",
  "analyst_id": "synthesis-liaison",
  "artifact_reviewed": [
    "protocol/tasks/PIG-001/unrouted/final-synthesis-message.json",
    "protocol/tasks/PIG-001/messages/003-revision.json",
    "protocol/tasks/PIG-001/evidence/feasibility-assessment-r2.md",
    "protocol/tasks/PIG-001/evidence/asset-inventory-effa805.md",
    "protocol/tasks/PIG-001/evidence/asset-inventory-effa805.json",
    "protocol/tasks/PIG-001/unrouted/rebaseline-effa805.md",
    "protocol/tasks/PIG-001/unrouted/ux-requirements.md",
    "protocol/tasks/PIG-001/unrouted/browser-evidence.md",
    "protocol/tasks/PIG-001/unrouted/decision-record.md",
    "tools/fetch_artworks.py:49",
    "tools/audit_artworks.py:99",
    "index.html",
    "docs/ADMIRE_SPEC.md:100",
    "pigment_coordinator/gates.py",
    "pigment_coordinator/analysts.py",
    "pigment_coordinator/messages.py"
  ],
  "confidence": {
    "basis": "Verbatim carry, evidence correspondence, and both the deterministic convergence gate and the message validator were verified programmatically against files on disk; the only open item is a decision-record ledger append, and build-phase evidence is correctly deferred rather than overclaimed.",
    "level": "high"
  },
  "constraints_or_principles_to_defend": [
    "Verbatim preservation of the 29 acceptance criteria and the risk register as the frozen evidence thresholds.",
    "The binding release constraints and conservative release language, including the prohibition on tuning taste data to silence validator warnings.",
    "Gate 1: no production-path edit, branch, merge, or deployment before approved_for_build and owner approval.",
    "The five decision-gated items routed to their designated deciders and surfaced to the owner in the Human Review Package.",
    "The pigment.taste.v1 additive-only, route/ID/slug stability guarantees named as the hardest reversibility limits."
  ],
  "convergence_recommended": true,
  "created_at": "2026-07-23T18:05:00Z",
  "critical_issues": [],
  "essential_principles": [
    "The revision's intended user outcome and its 29 objectively testable acceptance criteria are preserved verbatim, not weakened or paraphrased.",
    "Editorial positioning never waives factual, rights, privacy, or accessibility duties for any public claim or asset.",
    "Feasibility must be confirmed by a fresh Implementation Lead assessment against the complete effa805 scope, not inherited from the historical fourteen-unit plan.",
    "Recovery must restore exact checkpoint state or offer a truthful user-controlled continuation; warning-only handling does not pass.",
    "No unresolved asset is represented as cleared; no legal conclusion follows from death year, host platform, generic attribution, or user preference.",
    "No production edit occurs before an Implementation Specification at approved_for_build; main-branch merge and deployment always require the owner's explicit approval."
  ],
  "evidence_gaps": [
    "Build-phase and Gate-2 quality evidence (validator snapshot, journey/persistence/checkpoint transcripts, contrast reports, browser screenshots) does not yet exist; it is correctly deferred to the authorized build and independent Quality Review, not claimed now.",
    "Item-level rights-register population and any legal/privacy clearance conclusions await owner-authorized effort and qualified reviewers; the register structure and unresolved-by-default discipline are buildable now."
  ],
  "feasibility_supported": true,
  "human_escalation": {
    "decision_required": "",
    "reason_category": "",
    "recommended": false,
    "why_the_teams_cannot_resolve_it": ""
  },
  "intended_user_outcome": "A first-time visitor can discover art, admire works, form and recover a local Taste Passport, understand how actions affect it, and continue through Pigment's connected Atlas without silent state loss, inaccessible dead ends, misleading evidence claims, or unexplained transitions.",
  "intent_preserved": true,
  "noncritical_issues": [
    "REQUIRED PRE-TRANSMISSION REPAIR: the synthesis cites decision record D-013 (extmetadata correction) in disposition 2 and the rationale, but decision-record.md ends at D-012. The Synthesis Lead must append D-013 before routing so the cited ledger entry exists. This is a dangling reference to repair, not a convergence failure.",
    "Deployment-identity correspondence between the live GitHub Pages URL and effa805 is asserted as a procedure to run, not yet proven; the synthesis correctly labels it a remaining risk and defines how it will be proven (AC1)."
  ],
  "optional_forms": [
    "The 22-unit build plan ordering and sizing (Claude owns implementation method).",
    "sessionStorage additive key as the onboarding-checkpoint persistence mechanism.",
    "The exact-match-tier plus raised-cap search ranking method chosen in place of per-type quotas.",
    "The Google Fonts disposition among retain-with-approval, remove, and self-host.",
    "The internal commit granularity of the ARIA-state pass across control families."
  ],
  "owner_report": {